### ISSUE TITLE
Connecting stuck on `DHCP ESTABLISHED`

### ISSUE THREAD

**Issue by purplebar0** [vanilla-wiiu/vanilla#300]
Artix Linux; not using either NetworkManager or the other backend, just `dhcpcd`.

The USB Wi-Fi adaptor is `2357:0120 TP-Link Archer T2U PLUS [RTL8821AU]`, loaded as `rtw88_8821au 3-4:1.0: Firmware version 42.4.0, H2C version 0` by the in-kernel driver.

<details>
	<summary>Logs</summary>
<pre>
Looking for game controllers...
FAILED TO GET STATUS OF DEVICE wlan0
RECEIVED SCAN RESULTS
wlan0: CTRL-EVENT-REGDOM-CHANGE init=BEACON_HINT type=UNKNOWN
wlan0: CTRL-EVENT-REGDOM-CHANGE init=BEACON_HINT type=UNKNOWN
wlan0: CTRL-EVENT-REGDOM-CHANGE init=BEACON_HINT type=UNKNOWN
RECEIVED SCAN RESULTS
FOUND WII U, TESTING WPS PIN
wlan0: CTRL-EVENT-REGDOM-CHANGE init=BEACON_HINT type=UNKNOWN
wlan0: SME: Trying to authenticate with 18:2a:REDACTED (SSID='WiiUREDACTED_STA1' freq=5240 MHz)
CRED RECV: <3>SME: Trying to authenticate with 18:2a:REDACTED (SSID='WiiUREDACTED_STA1' freq=5240 MHz)REDACTED
wlan0: Trying to associate with 18:2a:REDACTED (SSID='WiiUREDACTED_STA1' freq=5240 MHz)
wlan0: Associated with 18:2a:REDACTED
wlan0: CTRL-EVENT-SUBNET-STATUS-UPDATE status=0
CRED RECV: <3>Trying to associate with 18:2a:REDACTED (SSID='WiiUREDACTED_STA1' freq=5240 MHz)240 MHz)REDACTED
CRED RECV: <3>Associated with 18:2a:REDACTED (SSID='WiiUREDACTED_STA1' freq=5240 MHz)240 MHz)REDACTED
CRED RECV: <3>CTRL-EVENT-SUBNET-STATUS-UPDATE status=0fd (SSID='WiiUREDACTED_STA1' freq=5240 MHz)240 MHz)REDACTED
wlan0: CTRL-EVENT-EAP-STARTED EAP authentication started
wlan0: CTRL-EVENT-EAP-PROPOSED-METHOD vendor=14122 method=1
wlan0: CTRL-EVENT-EAP-METHOD EAP vendor 14122 method 1 (WSC) selected
CRED RECV: <3>CTRL-EVENT-EAP-STARTED EAP authentication started'WiiUREDACTED_STA1' freq=5240 MHz)240 MHz)REDACTED
CRED RECV: <3>CTRL-EVENT-EAP-STATUS status='started' parameter=''iiUREDACTED_STA1' freq=5240 MHz)240 MHz)REDACTED
CRED RECV: <3>CTRL-EVENT-EAP-PROPOSED-METHOD vendor=14122 method=1iUREDACTED_STA1' freq=5240 MHz)240 MHz)REDACTED
CRED RECV: <3>CTRL-EVENT-EAP-STATUS status='accept proposed method' parameter='WSC'REDACTED_STA1' freq=5240 MHz)240 MHz)REDACTED
CRED RECV: <3>CTRL-EVENT-EAP-METHOD EAP vendor 14122 method 1 (WSC) selectedr='WSC'REDACTED_STA1' freq=5240 MHz)240 MHz)REDACTED
wlan0: WPS-CRED-RECEIVED 
wlan0: WPS-SUCCESS 
wlan0: CTRL-EVENT-EAP-FAILURE EAP authentication failed
wlan0: CTRL-EVENT-DISCONNECTED bssid=18:2a:REDACTED reason=3 locally_generated=1
wlan0: CTRL-EVENT-REGDOM-CHANGE init=CORE type=WORLD
CRED RECV: <3>WPS-CRED-RECEIVED HOD EAP vendor 14122 method 1 (WSC) selectedr='WSC'REDACTED_STA1' freq=5240 MHz)240 MHz)REDACTED
RECEIVED AUTHENTICATION FROM CONSOLE
SAVING CONFIG
wlan0: CTRL-EVENT-REGDOM-CHANGE init=BEACON_HINT type=UNKNOWN
nl80211: deinit ifname=wlan0 disabled_11b_rates=0
wlan0: CTRL-EVENT-TERMINATING 
wlan0: CTRL-EVENT-REGDOM-CHANGE init=BEACON_HINT type=UNKNOWN
wlan0: CTRL-EVENT-REGDOM-CHANGE init=BEACON_HINT type=UNKNOWN
WAITING FOR CONNECTION
CONN RECV: <3>CTRL-EVENT-SCAN-STARTED 
CONN RECV: <3>CTRL-EVENT-REGDOM-CHANGE init=BEACON_HINT type=UNKNOWN
CONN RECV: <3>CTRL-EVENT-REGDOM-CHANGE init=BEACON_HINT type=UNKNOWN
STILL WAITING FOR CONNECTED STATE
WAITING FOR CONNECTION
STILL WAITING FOR CONNECTED STATE
wlan0: SME: Trying to authenticate with 18:2a:REDACTED (SSID='WiiUREDACTED' freq=5240 MHz)
wlan0: Trying to associate with 18:2a:REDACTED (SSID='WiiUREDACTED' freq=5240 MHz)
wlan0: Associated with 18:2a:REDACTED
wlan0: CTRL-EVENT-SUBNET-STATUS-UPDATE status=0
wlan0: WPA: Key negotiation completed with 18:2a:REDACTED [PTK=CCMP GTK=CCMP]
wlan0: CTRL-EVENT-CONNECTED - Connection to 18:2a:REDACTED completed [id=0 id_str=]
WAITING FOR CONNECTION
CONN RECV: <3>CTRL-EVENT-SCAN-RESULTS 
info, udhcpc (v0.9.9-pre) started
CONN RECV: <3>WPS-AP-AVAILABLE 
CONN RECV: <3>SME: Trying to authenticate with 18:2a:REDACTED (SSID='WiiUREDACTED' freq=5240 MHz)
CONN RECV: <3>Trying to associate with 18:2a:REDACTED (SSID='WiiUREDACTED' freq=5240 MHz)
CONN RECV: <3>Associated with 18:2a:REDACTED
CONN RECV: <3>CTRL-EVENT-SUBNET-STATUS-UPDATE status=0
CONN RECV: <3>WPA: Key negotiation completed with 18:2a:REDACTED [PTK=CCMP GTK=CCMP]
CONN RECV: <3>CTRL-EVENT-CONNECTED - Connection to 18:2a:REDACTED completed [id=0 id_str=]
CONNECTED TO CONSOLE
debug, Sending discover...
debug, Sending select for 192.168.1.11...
info, Lease of 192.168.1.11 obtained, lease time 4294967295
DHCP ESTABLISHED
RECEIVED UNBIND SIGNAL
wlan0: CTRL-EVENT-DISCONNECTED bssid=18:2a:REDACTED reason=3 locally_generated=1
nl80211: deinit ifname=wlan0 disabled_11b_rates=0
wlan0: CTRL-EVENT-TERMINATING 
</pre>
</details>

Lines `RECEIVED UNBIND SIGNAL` and after were caused by manual canceling on my side after waiting for a while.

I [allowed ports and even disabled firewall](https://github.com/vanilla-wiiu/vanilla/wiki/Firewall) to no avail.

I installed [rtw88-dkms-git](https://aur.archlinux.org/packages/rtw88-dkms-git/) as suggested for RTL8821AU under [Wireless Compatibility](https://github.com/vanilla-wiiu/vanilla/wiki/Wireless-Compatibility) to no avail. This appears in kernel logs:

```
[    8.262560] rtw_core: loading out-of-tree module taints kernel.
[    8.262565] rtw_core: module verification failed: signature and/or required key missing - tainting kernel
[    8.288057] rtw_8821au 3-4:1.0: Firmware version 42.4.0, H2C version 0
[    8.900384] usbcore: registered new interface driver rtw_8821au
```

Notice how the driver changed from `rtw88_8821au` to `rtw_8821au`, that indicates that the expected one was loaded.

I tried both the release build and [vanilla-wiiu-git](https://aur.archlinux.org/packages/vanilla-wiiu-git).

**Comment by purplebar0** [comment]
I also tried long-deprecated [rtl8821au-dkms-git](https://aur.archlinux.org/packages/rtl8821au-dkms-git/) and it made no difference.

**Comment by itsmattkc** [comment]
Indeed, `rtw88` is the correct driver to use here, older drivers tend to fail connecting outright.

`DHCP ESTABLISHED` should be the last step of the connection process, which suggests everything was successful connection-wise. But looking at the logs, Vanilla clearly isn't receiving any packets for some reason.

Firewall is the most likely culprit, though you mention you've already disabled it. Maybe double check that the firewall is truly disabled and/or see if anything else might be blocking incoming UDP packets.

**Comment by purplebar0** [comment]
I stopped `nftables` firewall, `dhcpcd`, `dnsmasq`. From my understanding, `netifrc` is the sole network manager and it has no effect on `wlan0`.

I tried to have it control `wlan0` to no avail, as starting `net.wlan0` results in `start-stop-daemon: (null) does not exist`. I suspect it wouldn't make a difference anyway.

I noticed that `wlan0` interface is brought up automatically by Vanilla, so that seemingly shouldn't be the problem either.

I'm all out of ideas...

**Comment by itsmattkc** [comment]
When Vanilla is connected (after it says `DHCP ESTABLISHED`), can you send the output of `ip addr` and `ip route`?

**Comment by purplebar0** [comment]
```
4: wlan0: <BROADCAST,MULTICAST,UP,LOWER_UP> mtu 1500 qdisc noqueue state UP group default qlen 1000
    link/ether 98:03:REDACTED brd ff:ff:ff:ff:ff:ff
    inet 192.168.1.11/24 metric 4294967295 scope global wlan0
       valid_lft forever preferred_lft forever
    inet6 fe80::REDACTED/64 scope link proto kernel_ll 
       valid_lft forever preferred_lft forever
```

```
192.168.1.0/24 dev wlan0 proto kernel scope link src 192.168.1.11 metric 4294967295
```

**Comment by itsmattkc** [comment]
Are you able to `ping 192.168.1.10` while Vanilla is connected?

Also check the results of `tcpdump -i wlan0 udp` to see what traffic (if any) is happening on your Wi-Fi interface.

**Comment by purplebar0** [comment]
Using ping makes it use my `eth0` link 192.168.0.0/16 judging by the address... Maybe that's what's up?

`tcpdump` reveals rapid traffic going back and forth of varying length between 192.168.1.10 and .11.

**Comment by purplebar0** [comment]
The nuclear approach of plugging out my ethernet cable made pinging possible, but didn't make any difference in Vanilla.

**Comment by itsmattkc** [comment]
With your ethernet disconnected, can you try `ip addr flush dev eth0` and then try Vanilla again?

**Comment by purplebar0** [comment]
I plugged out my ethernet cable another time and didn't need to do anything else, Vanilla got video stream. A few seconds after I plugged it back in, it froze.

**Comment by itsmattkc** [comment]
So the good news is, this is a relatively simple routing issue. The bad news is, Vanilla is explicitly supposed to be able to route around such situations.

Can you show me the rest of your `ip addr` and `ip route`, including your ethernet connection?

**Comment by purplebar0** [comment]
```
1: lo: <LOOPBACK,UP,LOWER_UP> mtu 65536 qdisc noqueue state UNKNOWN group default qlen 1000
    link/loopback 00:00:00:00:00:00 brd 00:00:00:00:00:00
    inet 127.0.0.1/8 brd 127.255.255.255 scope host lo
       valid_lft forever preferred_lft forever
    inet6 ::1/128 scope host proto kernel_lo 
       valid_lft forever preferred_lft forever
2: eth0: <BROADCAST,MULTICAST,UP,LOWER_UP> mtu 1500 qdisc fq_codel state UP group default qlen 1000
    link/ether 70:85:REDACTED brd ff:ff:ff:ff:ff:ff
    inet 192.168.1.REDACTED/24 brd 192.168.1.255 scope global dynamic noprefixroute eth0
       valid_lft 86187sec preferred_lft 75387sec
    inet6 fe80::REDACTED/64 scope link 
       valid_lft forever preferred_lft forever
3: wlan0: <BROADCAST,MULTICAST,UP,LOWER_UP> mtu 1500 qdisc noqueue state UP group default qlen 1000
    link/ether 98:03:REDACTED brd ff:ff:ff:ff:ff:ff
    inet 192.168.1.11/24 brd 192.168.1.255 scope global noprefixroute wlan0
       valid_lft forever preferred_lft forever
    inet6 fe80::REDACTED/64 scope link 
       valid_lft forever preferred_lft forever
```

```
default via 192.168.1.1 dev eth0 proto dhcp src 192.168.1.REDACTED metric 1002 
default via 192.168.1.1 dev wlan0 proto dhcp src 192.168.1.11 metric 3003 
127.0.0.0/8 via 127.0.0.1 dev lo 
192.168.1.0/24 dev eth0 proto dhcp scope link src 192.168.1.REDACTED metric 1002 
192.168.1.0/24 dev wlan0 proto dhcp scope link src 192.168.1.11 metric 3003
```

**Comment by purplebar0** [comment]
A little update that may be a red herring as I don't know how to interpret tcpdump outputs at the end; I'm seeing a large number of packets dropped by the kernel:

```
(...)
20:48:19.062244 IP 192.168.1.10.50021 > 192.168.1.11.50121: UDP, length 1672
20:48:19.063396 IP 192.168.1.10.50020 > 192.168.1.11.50120: UDP, length 635
20:48:19.065528 IP 192.168.1.10.50020 > 192.168.1.11.50120: UDP, length 1710
20:48:19.065532 IP 192.168.1.10.50020 > 192.168.1.11.50120: UDP, length 179
^C
905180 packets captured
922518 packets received by filter
17338 packets dropped by kernel
```

Are those numbers coming from other interfaces? I have no idea. All I know is that I don't have `iproute` rules I'm aware of, only `nftables`, which I was already stopping during testing.

Edit: For clarity, again, going further back in the log, there are many connections made back and forth between .10 and .11 both ways. This actually feels a lot like the main Vanilla process can't get packets for some reason, whereas pipe communicates as expected...?

**Comment by itsmattkc** [comment]
Those definitely appear to be Wii U packets. Seems the Linux kernel is dropping them before Vanilla can see them.

Can you send the output of:

```
sysctl net.ipv4.conf.default.rp_filter net.ipv4.conf.eth0.rp_filter net.ipv4.conf.wlan0.rp_filter
```

**Comment by purplebar0** [comment]
```
net.ipv4.conf.default.rp_filter = 0
net.ipv4.conf.eth0.rp_filter = 0
net.ipv4.conf.wlan0.rp_filter = 0
```

**Comment by itsmattkc** [comment]
Try setting the following and then try running Vanilla again (these will be temporary until next boot):

```
sysctl -w net.ipv4.conf.all.rp_filter=2
sysctl -w net.ipv4.conf.default.rp_filter=2
sysctl -w net.ipv4.conf.eth0.rp_filter=2
sysctl -w net.ipv4.conf.wlan0.rp_filter=2
```

**Comment by purplebar0** [comment]
Unfortunately, that didn't make a difference.

Unrelated to that, it looks like the Wii U itself got into a state where it wasn't broadcasting 5 GHz at all and showed an error dialogue, so I restarted it. That took me a bit to figure out.

Edit: Before and after applying these parameters (as in, set to 0 or 2 all the same), I get 0 dropped packets. I am pretty confident that was indeed a red herring.

**Comment by itsmattkc** [comment]
> Unrelated to that, it looks like the Wii U itself got into a state where it wasn't broadcasting 5 GHz at all and showed an error dialogue, so I restarted it. That took me a bit to figure out.

Heh this is fairly common in my experience. It might be some kind of anti-bruteforce cooldown, but the gamepad AP can just kind of disappear if it's interacted with too much.

> Edit: Before and after applying these parameters (as in, set to 0 or 2 all the same), I get 0 dropped packets. I am pretty confident that was indeed a red herring.

I think it has to be the kernel dropping something. Run locally, the pipe doesn't relay packets, it only maintains the connection (it's more efficient for the frontend to just open UDP sockets and receive packets directly). So if Vanilla isn't receiving them, something outside of Vanilla must be blocking them.

**Comment by purplebar0** [comment]
I am completely out of ideas as there are no relevant networking `sysctl` parameters set on my system.

I had the idea to try network namespaces, but I really struggle with `iproute`, so I tried to follow [Baeldung's guide](https://www.baeldung.com/linux/different-network-interfaces-processes#bd-using-network-namespaces) to no avail:

```
error: XDG_RUNTIME_DIR is invalid or not set in the environment.
Failed to open audio device
Failed to open microphone device
Looking for game controllers...
FAILED TO GET STATUS OF DEVICE wlan0_ns
nl80211: Driver does not support authentication/association or connect commands
nl80211: deinit ifname=wlan0_ns disabled_11b_rates=0
wlan0_ns: Failed to initialize driver interface
FAILED TO ADD WPA IFACE
STILL WAITING FOR CONNECTED STATE
STILL WAITING FOR CONNECTED STATE
STILL WAITING FOR CONNECTED STATE
STILL WAITING FOR CONNECTED STATE
STILL WAITING FOR CONNECTED STATE
RECEIVED UNBIND SIGNAL
```

Moving `wlan0` to a separate interface won't work because, to my understanding, the wireless driver doesn't support it.

Edit: I tried [bind.c](https://github.com/X4BNet/ld_preload_shim) and [BindToInterface](https://github.com/JsBergbau/BindToInterface) to no avail.

Edit: Adding route to .10 after Vanilla establishes connections makes pinging possible, but doesn't make Vanilla work correctly:

```
$ ping 192.168.1.10                          
PING 192.168.1.10 (192.168.1.10) 56(84) bytes of data.
From 192.168.1.REDACTED icmp_seq=1 Destination Host Unreachable
From 192.168.1.REDACTED icmp_seq=2 Destination Host Unreachable
From 192.168.1.REDACTED icmp_seq=3 Destination Host Unreachable
^C
--- 192.168.1.10 ping statistics ---
5 packets transmitted, 0 received, +3 errors, 100% packet loss, time 4084ms
pipe 4
# route add -host 192.168.1.10 dev wlan0
$ ping 192.168.1.10                          
PING 192.168.1.10 (192.168.1.10) 56(84) bytes of data.
64 bytes from 192.168.1.10: icmp_seq=1 ttl=64 time=2.10 ms
64 bytes from 192.168.1.10: icmp_seq=2 ttl=64 time=5.14 ms
64 bytes from 192.168.1.10: icmp_seq=3 ttl=64 time=2.32 ms
^C
--- 192.168.1.10 ping statistics ---
3 packets transmitted, 3 received, 0% packet loss, time 2002ms
rtt min/avg/max/mdev = 2.099/3.184/5.135/1.382 ms
```

Edit: Looks like the dropped packets in `tcpdump` are entirely a red herring according to [a Stack Exchange page](https://unix.stackexchange.com/questions/144794/why-would-the-kernel-drop-packets).

**Comment by itsmattkc** [comment]
Sorry I couldn't help with this but I don't think there's much more I can do from here so I'm going to close this. Hope you find a solution at some point.
